{
  "machine_key": "example-linux-node-a1b2c3",
  "identity": { "hostname": "example-linux-node", "os": "linux", "arch": "x86_64" },
  "profile_projection": {},
  "capabilities": [
    { "kind": "serve_model", "id": "qwen2.5-1.5b-instruct", "engine": "vulkan", "evidence": "characterized" },
    { "kind": "embeddings", "id": "bge-large-en", "engine": "cpu", "evidence": "estimated" }
  ],
  "environment": {
    "platform": "linux",
    "accel": "vulkan",
    "containerized": false,
    "virtualization_layer": null,
    "wall_source": "physical"
  }
}
